<?xml version="1.0" encoding="UTF-8"?>
<nutzconfig xmlns:xsi="http://www.w3.org/2001/XMLSchema-instance"
	xsi:noNamespaceSchemaLocation="nutz.ioc-1.0.xsd">
	<ioc>
		<bean id="myBean" type="java.lang.Object">
			<args>
				<arg type="refer" value="sb"></arg>
			</args>
			<fields>
				<field name="Field2" type="java.lang.Long" value="10"></field>
			</fields>
			<events>
				<create value="create"></create>
				<depose value="depose"></depose>
				<fetch value="fetch"></fetch>
			</events>
		</bean>
		<bean id="sb" type="java.lang.Object"/>
		<bean id="fox" />
		<bean id="nutz" parent="fox">
		</bean>
		
		<bean id="op" type="java.lang.String">
			<args>
				<arg value="Wendal"/>
			</args>
		</bean>
		<bean id="op2" parent="op">
			<fields>
				<field name="xx" value="yy"/>
			</fields>
		</bean>
		
		<bean id="op3" parent="op2">
			<events>
				<depose value="depose"/>
			</events>
		</bean>
		
		<bean id="op4" parent="op3"></bean>
		
		<bean id="op5" parent="op2">
			<events>
				<create value="ct"/>
			</events>
		</bean>
		
		<bean id="sb2">
			<events>
				<create value="toString"/>
			</events>
		</bean>
		
		<!-- 循环依赖 -->
<!--		<bean id="p1" parent="p2"></bean>-->
<!--		<bean id="p2" parent="p1"></bean>-->
		<!-- 依赖自身 -->
<!--		<bean id="p3" parent="p3"></bean>-->
	</ioc>
</nutzconfig>